{
  "manifest_version": 1,
  "project": "Outpost-7",
  "generated_by": "tools/harness/seed_manifest.py",
  "global_budget": {
    "usd_cap_monthly": 150.0,
    "usd_spent_month": 0.0,
    "month": ""
  },
  "palettes": {
    "jungle": {
      "corroded_titanium": "#3A3F48",
      "jungle_vine": "#1A3320",
      "neon_magenta": "#FF3EC8",
      "bio_teal": "#00E8D8",
      "chitin": "#22102E"
    },
    "volcanic": {
      "obsidian": "#0D0D12",
      "charcoal": "#1F1F24",
      "molten_orange": "#FF6A1A",
      "lava_red": "#FF2818",
      "warning_amber": "#FFAA33",
      "ash_grey": "#5A5A60"
    },
    "ice": {
      "gunmetal": "#4A525C",
      "glacial_ice": "#C8E8FF",
      "deep_ice": "#5A8CC0",
      "frost_blue": "#AAE0FF",
      "edge_white": "#E8F4FF",
      "shadow_blue": "#3A5078"
    },
    "military": {
      "charcoal_black": "#1A1A22",
      "steel_blue": "#5082B4",
      "gunmetal": "#3A4048",
      "base_shadow": "#2A3540",
      "warning_red": "#FF3838",
      "muzzle_red": "#FF5050",
      "amber": "#FFAA33",
      "tactical_white": "#DDE2E8",
      "plasma_blue": "#00AAFF",
      "recon_blue": "#5096E8",
      "olive": "#5A7048",
      "eng_green": "#88E060"
    },
    "ui": {
      "industrial_bg": "#1C1E22",
      "industrial_panel": "#26282C",
      "text_primary": "#E6E6DC",
      "accent_orange": "#FF9632",
      "jungle_accent": "#78DCB4",
      "ice_accent": "#78C8F0",
      "volcanic_accent": "#FF783C",
      "danger": "#DC3C3C"
    }
  },
  "elements": [
    {
      "id": "build_turret_auto",
      "group": "Buildables",
      "group_id": "build",
      "name": "Auto-Turret",
      "tier": "multi_mesh",
      "class": "buildable",
      "integration_target": "BuildableRegistry.turret (model field, H4)",
      "dims_studs": [
        2,
        4,
        2
      ],
      "tri_budget": [
        1500,
        2500
      ],
      "palette": "military",
      "brief": "Single-barrel auto-turret: square base plate with power cables, yaw joint, sensor-cluster head with a 3-stud barrel and faint red muzzle ring. Sub-meshes: Base, Head.",
      "reference": "ASSETS.md §4.4.1",
      "priority": 1,
      "gated": false,
      "state": "pending_brief",
      "approved_variant": null,
      "artifacts": {},
      "license": null,
      "asset_ids": {},
      "cost_usd": 0.0,
      "attempts": {
        "concept_rounds": 0,
        "model_generations": 0,
        "validations": 0
      },
      "history": [],
      "budget": {
        "concept_images_per_round": 8,
        "concept_rounds": 3,
        "model_generations": 3,
        "usd_cap": 6.0
      }
    },
    {
      "id": "alien_stalker",
      "group": "Aliens",
      "group_id": "alien",
      "name": "Stalker (jungle)",
      "tier": "rigged",
      "class": "alien",
      "integration_target": "AlienRegistry.stalker.meshTemplate",
      "dims_studs": [
        6,
        4,
        2
      ],
      "tri_budget": [
        5000,
        7000
      ],
      "palette": "jungle",
      "brief": "Quadruped predator: chitinous plates with magenta bioluminescent seams, 2x3 teal eye cluster, mandible mouth, spine frill, segmented glowing tail tip. Low predatory stance.",
      "reference": "ASSETS.md §4.3.1",
      "priority": 2,
      "gated": false,
      "state": "pending_brief",
      "approved_variant": null,
      "artifacts": {},
      "license": null,
      "asset_ids": {},
      "cost_usd": 0.0,
      "attempts": {
        "concept_rounds": 0,
        "model_generations": 0,
        "validations": 0
      },
      "history": [],
      "budget": {
        "concept_images_per_round": 8,
        "concept_rounds": 3,
        "model_generations": 3,
        "usd_cap": 6.0
      }
    },
    {
      "id": "drone_combat",
      "group": "Drones",
      "group_id": "drone",
      "name": "Combat drone",
      "tier": "static_mesh",
      "class": "drone",
      "integration_target": "DroneSwarmRegistry.combat template (H4)",
      "dims_studs": [
        1.2,
        0.4,
        0.8
      ],
      "tri_budget": [
        800,
        1200
      ],
      "palette": "military",
      "brief": "Wedge fighter drone, twin forward laser barrels, red sensor lens, red-orange thrusters, charcoal/red.",
      "reference": "ASSETS.md §4.5.2",
      "priority": 3,
      "gated": false,
      "state": "pending_brief",
      "approved_variant": null,
      "artifacts": {},
      "license": null,
      "asset_ids": {},
      "cost_usd": 0.0,
      "attempts": {
        "concept_rounds": 0,
        "model_generations": 0,
        "validations": 0
      },
      "history": [],
      "budget": {
        "concept_images_per_round": 8,
        "concept_rounds": 3,
        "model_generations": 3,
        "usd_cap": 6.0
      }
    },
    {
      "id": "arch_jungle",
      "group": "Biome arches",
      "group_id": "arch",
      "name": "Bioluminescent Jungle Arch",
      "tier": "static_mesh",
      "class": "world.arch",
      "integration_target": "PlotManager arch slot (H4)",
      "dims_studs": [
        24,
        18,
        4
      ],
      "tri_budget": [
        4000,
        6000
      ],
      "palette": "jungle",
      "brief": "Corroded military structural frame overgrown by alien jungle: glowing vines on weathered titanium beams, magenta/teal bioluminescent flora in the cracks.",
      "reference": "ASSETS.md §4.1.1",
      "priority": 10,
      "gated": false,
      "state": "pending_brief",
      "approved_variant": null,
      "artifacts": {},
      "license": null,
      "asset_ids": {},
      "cost_usd": 0.0,
      "attempts": {
        "concept_rounds": 0,
        "model_generations": 0,
        "validations": 0
      },
      "history": [],
      "budget": {
        "concept_images_per_round": 8,
        "concept_rounds": 3,
        "model_generations": 3,
        "usd_cap": 6.0
      }
    },
    {
      "id": "build_extractor",
      "group": "Buildables",
      "group_id": "build",
      "name": "Extractor",
      "tier": "static_mesh",
      "class": "buildable",
      "integration_target": "BuildableRegistry.extractor (model field, H4)",
      "dims_studs": [
        3,
        4,
        3
      ],
      "tri_budget": [
        1500,
        2500
      ],
      "palette": "military",
      "brief": "Compact resource extractor: drill column into a crystal node, spinning collar, side coolant tanks, teal intake glow at the base, credit-coil readout on top. Reads as the colony's income core.",
      "reference": "BuildableRegistry.luau",
      "priority": 11,
      "gated": false,
      "state": "pending_brief",
      "approved_variant": null,
      "artifacts": {},
      "license": null,
      "asset_ids": {},
      "cost_usd": 0.0,
      "attempts": {
        "concept_rounds": 0,
        "model_generations": 0,
        "validations": 0
      },
      "history": [],
      "budget": {
        "concept_images_per_round": 8,
        "concept_rounds": 3,
        "model_generations": 3,
        "usd_cap": 6.0
      }
    },
    {
      "id": "build_wall",
      "group": "Buildables",
      "group_id": "build",
      "name": "Wall segment",
      "tier": "static_mesh",
      "class": "buildable",
      "integration_target": "BuildableRegistry.wall (model field, H4)",
      "dims_studs": [
        4,
        5,
        1
      ],
      "tri_budget": [
        600,
        1200
      ],
      "palette": "military",
      "brief": "Modular 4-stud wall segment: layered armor plates over a titanium spine, energy-seam glow along the top edge, tileable ends so segments chain cleanly. Three damage states later (see dmg_*).",
      "reference": "BuildableRegistry.luau",
      "priority": 12,
      "gated": false,
      "state": "pending_brief",
      "approved_variant": null,
      "artifacts": {},
      "license": null,
      "asset_ids": {},
      "cost_usd": 0.0,
      "attempts": {
        "concept_rounds": 0,
        "model_generations": 0,
        "validations": 0
      },
      "history": [],
      "budget": {
        "concept_images_per_round": 8,
        "concept_rounds": 3,
        "model_generations": 3,
        "usd_cap": 6.0
      }
    },
    {
      "id": "prop_resource_node",
      "group": "World props",
      "group_id": "prop",
      "name": "Resource node (crystal cluster)",
      "tier": "static_mesh",
      "class": "world_prop",
      "integration_target": "ResourceNodeSpawner template (H4)",
      "dims_studs": [
        4,
        3,
        4
      ],
      "tri_budget": [
        600,
        1200
      ],
      "palette": "jungle",
      "brief": "Ground crystal cluster the extractor drills into: teal-core crystals in a rock collar with a faint pulse. Must read as 'place extractor here' from FTUE distance.",
      "reference": "ResourceNodeSpawner.luau",
      "priority": 13,
      "gated": false,
      "state": "pending_brief",
      "approved_variant": null,
      "artifacts": {},
      "license": null,
      "asset_ids": {},
      "cost_usd": 0.0,
      "attempts": {
        "concept_rounds": 0,
        "model_generations": 0,
        "validations": 0
      },
      "history": [],
      "budget": {
        "concept_images_per_round": 8,
        "concept_rounds": 3,
        "model_generations": 3,
        "usd_cap": 6.0
      }
    },
    {
      "id": "weapon_rifle_world",
      "group": "Player weapon",
      "group_id": "weapon",
      "name": "Hitscan rifle — world model",
      "tier": "static_mesh",
      "class": "weapon",
      "integration_target": "WeaponController / character Tool (H4)",
      "dims_studs": [
        0.4,
        0.8,
        2.6
      ],
      "tri_budget": [
        1500,
        2500
      ],
      "palette": "military",
      "brief": "Compact sci-fi carbine: charcoal body, steel-blue rails, teal energy cell window, short muzzle with a red emissive ring. Held R15 grip.",
      "reference": "PHASE_R R3",
      "priority": 14,
      "gated": false,
      "state": "pending_brief",